{
  "status": "success",
  "pdf_file": "out/sample_sre_assessment_toc_fixed.pdf",
  "page_count": 4,
  "layout_validation": {
    "proper_indentation": true,
    "no_overlap_detected": true,
    "no_text_clipping": true,
    "no_table_overflow": true,
    "no_image_overflow": true,
    "render_validation_successful": true
  },
  "warnings": [],
  "errors": []
}